{
  "schema": "kintsugi-grc-control-clauses-schema-v2",
  "jira": "KINTGRC-13",
  "generated": "2026-08-12",
  "vectorization": {
    "status": "embedding_ready",
    "embedding_field": "embedding_text",
    "id_field": "chunk_id",
    "recommended_model": "sentence-transformers/all-MiniLM-L6-v2 (384-dim) or any FAISS-compatible encoder",
    "notes": "Embed 'embedding_text' per chunk; store 'chunk_id' as the FAISS external ID. All other fields are retrieval metadata. Files intentionally contain no vectors so the index stays model-agnostic.",
    "generated": "2026-08-12"
  },
  "hitrust_controls": [
    {
      "control_reference": "01.c",
      "control_title": "Privilege Management",
      "objective_id": "01.02",
      "objective_title": "Authorized Access to Information Systems",
      "category_id": "01.0",
      "category_title": "Access Control",
      "requirement_summary": "The allocation and use of privileges to information systems and services is restricted and controlled. Privileges are allocated on a need-to-use basis and only after formal authorization, applying the principle of least privilege; privileged access is tracked to an identified role or individual.",
      "technical_validation_method": "Active Directory/host UID/GID shadow access check: enumerate file and directory ownership, group membership breadth, and world-writable or otherwise overbroad permission bits against a least-privilege baseline; flag orphaned owners and privilege sprawl.",
      "framework_mappings": {
        "hipaa": [
          {
            "chunk_id": "hipaa__164-308-a-3-i__01-c",
            "hitrust_control": {
              "control_reference": "01.c",
              "control_title": "Privilege Management"
            },
            "id": "164.308(a)(3)(i)",
            "title": "Standard: Workforce security",
            "text": "Implement policies and procedures to ensure that all members of its workforce have appropriate access to electronic protected health information, as provided under paragraph (a)(4) of this section, and to prevent those workforce members who do not have access under paragraph (a)(4) of this section from obtaining access to electronic protected health information.",
            "mapping_rationale": "Workforce security is HIPAA's administrative expression of privilege management: access is appropriate to role and denied to everyone else, which is exactly the allocation-and-restriction intent of 01.c.",
            "technical_validation_method": "Active Directory/host UID/GID shadow access check: enumerate file and directory ownership, group membership breadth, and world-writable or otherwise overbroad permission bits against a least-privilege baseline; flag orphaned owners and privilege sprawl.",
            "applicability": "Applicable - in MVP scope",
            "citation": "45 CFR 164.308(a)(3)(i), verified against eCFR (www.ecfr.gov), title 45 current as of 2026-08-10, retrieved 2026-08-12",
            "embedding_text": "Standard: Workforce security (164.308(a)(3)(i)). Implement policies and procedures to ensure that all members of its workforce have appropriate access to electronic protected health information, as provided under paragraph (a)(4) of this section, and to prevent those workforce members who do not have access under paragraph (a)(4) of this section from obtaining access to electronic protected health information. | HITRUST anchor: 01.c Privilege Management - The allocation and use of privileges to information systems and services is restricted and controlled. Privileges are allocated on a need-to-use basis and only after formal authorization, applying the principle of least privilege; privileged access is tracked to an identified role or individual."
          },
          {
            "chunk_id": "hipaa__164-308-a-4-i__01-c",
            "hitrust_control": {
              "control_reference": "01.c",
              "control_title": "Privilege Management"
            },
            "id": "164.308(a)(4)(i)",
            "title": "Standard: Information access management",
            "text": "Implement policies and procedures for authorizing access to electronic protected health information that are consistent with the applicable requirements of subpart E of this part.",
            "mapping_rationale": "Formal authorization of access before it is granted is the core mechanism of privilege management under 01.c (need-to-use, authorize-then-grant).",
            "technical_validation_method": "Active Directory/host UID/GID shadow access check: enumerate file and directory ownership, group membership breadth, and world-writable or otherwise overbroad permission bits against a least-privilege baseline; flag orphaned owners and privilege sprawl.",
            "applicability": "Applicable - in MVP scope",
            "citation": "45 CFR 164.308(a)(4)(i), verified against eCFR (www.ecfr.gov), title 45 current as of 2026-08-10, retrieved 2026-08-12",
            "embedding_text": "Standard: Information access management (164.308(a)(4)(i)). Implement policies and procedures for authorizing access to electronic protected health information that are consistent with the applicable requirements of subpart E of this part. | HITRUST anchor: 01.c Privilege Management - The allocation and use of privileges to information systems and services is restricted and controlled. Privileges are allocated on a need-to-use basis and only after formal authorization, applying the principle of least privilege; privileged access is tracked to an identified role or individual."
          },
          {
            "chunk_id": "hipaa__164-308-a-4-ii-c__01-c",
            "hitrust_control": {
              "control_reference": "01.c",
              "control_title": "Privilege Management"
            },
            "id": "164.308(a)(4)(ii)(C)",
            "title": "Access establishment and modification (Addressable)",
            "text": "Implement policies and procedures that, based upon the covered entity's or the business associate's access authorization policies, establish, document, review, and modify a user's right of access to a workstation, transaction, program, or process.",
            "mapping_rationale": "Establish/document/review/modify of access rights is the operational review loop 01.c requires for allocated privileges.",
            "technical_validation_method": "Active Directory/host UID/GID shadow access check: enumerate file and directory ownership, group membership breadth, and world-writable or otherwise overbroad permission bits against a least-privilege baseline; flag orphaned owners and privilege sprawl.",
            "applicability": "Applicable - in MVP scope",
            "citation": "45 CFR 164.308(a)(4)(ii)(C), verified against eCFR (www.ecfr.gov), title 45 current as of 2026-08-10, retrieved 2026-08-12",
            "embedding_text": "Access establishment and modification (Addressable) (164.308(a)(4)(ii)(C)). Implement policies and procedures that, based upon the covered entity's or the business associate's access authorization policies, establish, document, review, and modify a user's right of access to a workstation, transaction, program, or process. | HITRUST anchor: 01.c Privilege Management - The allocation and use of privileges to information systems and services is restricted and controlled. Privileges are allocated on a need-to-use basis and only after formal authorization, applying the principle of least privilege; privileged access is tracked to an identified role or individual."
          },
          {
            "chunk_id": "hipaa__164-312-a-1__01-c",
            "hitrust_control": {
              "control_reference": "01.c",
              "control_title": "Privilege Management"
            },
            "id": "164.312(a)(1)",
            "title": "Standard: Access control",
            "text": "Implement technical policies and procedures for electronic information systems that maintain electronic protected health information to allow access only to those persons or software programs that have been granted access rights as specified in 164.308(a)(4).",
            "mapping_rationale": "The technical enforcement point for granted privileges; maps to 01.c as the mechanism that makes least-privilege allocation real on systems holding ePHI.",
            "technical_validation_method": "Active Directory/host UID/GID shadow access check: enumerate file and directory ownership, group membership breadth, and world-writable or otherwise overbroad permission bits against a least-privilege baseline; flag orphaned owners and privilege sprawl.",
            "applicability": "Applicable - in MVP scope",
            "citation": "45 CFR 164.312(a)(1), verified against eCFR (www.ecfr.gov), title 45 current as of 2026-08-10, retrieved 2026-08-12",
            "embedding_text": "Standard: Access control (164.312(a)(1)). Implement technical policies and procedures for electronic information systems that maintain electronic protected health information to allow access only to those persons or software programs that have been granted access rights as specified in 164.308(a)(4). | HITRUST anchor: 01.c Privilege Management - The allocation and use of privileges to information systems and services is restricted and controlled. Privileges are allocated on a need-to-use basis and only after formal authorization, applying the principle of least privilege; privileged access is tracked to an identified role or individual."
          },
          {
            "chunk_id": "hipaa__164-312-a-2-i__01-c",
            "hitrust_control": {
              "control_reference": "01.c",
              "control_title": "Privilege Management"
            },
            "id": "164.312(a)(2)(i)",
            "title": "Unique user identification (Required)",
            "text": "Assign a unique name and/or number for identifying and tracking user identity.",